<?xml version="1.0" encoding="utf-8"?>
<!-- Created with Liquid XML Studio 1.0.8.0 (http://www.liquid-technologies.com) -->
<report xmlns:xsi="http://www.w3.org/2001/XMLSchema-instance" xsi:noNamespaceSchemaLocation="report_schema.xsd">
  <textformat name="tf1" setFontWeight="96" setFontPointSize="18" setFontItalic="true" setForeground="#00ff00"/>
  <textformat name="tf2" setFontWeight="72" setFontPointSize="12" setFontItalic="true" />
  <blockformat name="bf1" setAlignment="22" />
  <frame name="topframe" type="current" format="currentedit" fname="tff" padding="16">
	<insertblock blockformat="bf1"/>
	<chart library="pychartdir" name="chart1" type="trans_deb">
	</chart>
	<frame name="fr2" datasource="args" type="current" format="currentnew" fname="tff1">
		<insertblock />
		<insertblock />
		<inserttext text="Дата начала: " textformat="tf2" />
		<insertdatanontext index = '0' />
		<insertblock />
		<inserttext text="Дата окончания: "/>
		<insertdatanontext index = '1' />
		<insertblock />
		<insertblock />
	</frame>
  </frame>
</report>