<?xml version="1.0" encoding="utf-8"?>
<!-- Created with Liquid XML Studio 1.0.8.0 (http://www.liquid-technologies.com) -->
<report xmlns:xsi="http://www.w3.org/2001/XMLSchema-instance" xsi:noNamespaceSchemaLocation="report_schema.xsd">
	<textformat name="whitetf10" setFontWeight="72" setFontPointSize="10" setForeground="#FFFFFF" />
	<textformat name="stf1" setFontWeight="72" setFontPointSize="12" setForeground="#3d3d3d" />
	<textformat name="stf2" setFontWeight="72" setFontPointSize="11" setForeground="#5e93b6" />
	<textformat name="stf3" setFontWeight="36" setFontPointSize="11" setForeground="#000000" />
	<blockformat name="centerbf" setAlignment="22" />
	<frame name="topframe" format="currentedit" setWidth="840" fname="topff" padding="0">
		<image path="images/reports/header.png" />
		<frame name="uprblockfr" format="new" fname="ubff" setHeight="50" setWidth="840" padding="4" setBackground="#323232">
			<insertblock blockformat="centerbf" />
			<inserttext text="Скорость по портам" textformat="whitetf10" />
			<insertblock />
		</frame>
		<frame name="cframe" type="existing" format="new" setWidth="840" fname="cff">
			<insertblock blockformat="centerbf" />
			<chart library="pychartdir" name="chart1" type="nfs_multi_classes_speed">
				<getdata>
				</getdata>
			</chart>
		</frame>
		<frame name="chtbl2fr" datasource="args" type="current" format="currentnew" setWidth="840" fname="chtbl2ff">
			<insertblock />
			<insertblock blockformat="centerbf" />
			<inserttext text="ПЕРИОД: " textformat="stf1" />
			<inserttext text="с " textformat="stf3" />
			<insertdatanontext index="0" textformat="stf2" />
			<inserttext text=" по " textformat="stf3" />
			<insertdatanontext index="1" textformat="stf2" />
			<insertblock />
			<insertblock />
		</frame>
	</frame>
</report>