<?xml version="1.0" encoding="utf-8"?>
<!-- Created with Liquid XML Studio 1.0.8.0 (http://www.liquid-technologies.com) -->
<report xmlns:xsi="http://www.w3.org/2001/XMLSchema-instance" xsi:noNamespaceSchemaLocation="report_schema.xsd">
  <textformat name="tf1" setFontWeight="96" setFontPointSize="14" />
  <textformat name="tf2" setFontWeight="72" setFontPointSize="12" setFontItalic="true" />
  <blockformat name="bf1" setAlignment="22" />
  <frame name="topframe" type="current" format="currentedit" fname="tff" padding="16">
    <frame name="referenceframe" type="insert" format="new" fname="rff" formattype="textframe" padding="16">
	  <insertblock blockformat="bf1"/>
      <inserttext text="Отчёт по классам траффика с выбором сервера доступа" textformat="tf1"/>
      <insertblock blockformat="defbf"/>
    </frame>    
    <insertblock />
	<insertblock />
	<insertblock />

	<chart library="pychartdir" name="chart1" type="nfs_nas_traf">
		<frame name="fr2" datasource="args" type="current" format="currentnew" fname="tff1">
			<insertblock />
			<inserttext text="Дата начала: " textformat="tf2" />
			<insertdatanontext index = '0' />
			<insertblock />
			<inserttext text="Дата окончания: "/>
			<insertdatanontext index = '1' />
			<insertblock />
		</frame>
		<getdata>
			<selstring name="get_nas" dataid="ch1datanas"/>
			<insertblock/>			
			<frame name="ch1fr4" datasource="ch1datanas" type="current" format="current">
				<table name="tbl3" columns="2" type="normal" ftype="new" setCellPadding="2"  setBackground="#c0a0c0" fname="tf2" arheader="Выбранный сервер доступа: ">
					<column name="Имя" type="string" />
					<column name="Тип" type="string" />
				</table>
			</frame>
		</getdata>		
	</chart>

  </frame>
</report>