<?xml version="1.0" encoding="utf-8"?>
<!-- Created with Liquid XML Studio 1.0.8.0 (http://www.liquid-technologies.com) -->
<report xmlns:xsi="http://www.w3.org/2001/XMLSchema-instance" xsi:noNamespaceSchemaLocation="report_schema.xsd">
  <textformat name="tf1" setFontWeight="77" setFontItalic="true" setForeground="#00ff00"/>
  <blockformat name="bf1" setAlignment="22" />
  <frame name="topframe" type="current" format="currentedit" fname="tff" padding="16">
    <frame name="referenceframe" type="insert" format="new" fname="rff" formattype="textframe" padding="16">
      <inserttext text="string" />
      <insertblock />
    </frame>
    <inserttext text="дапашолты" />
    <insertblock />
	<chart library="pychartdir" name="chart1" type="nfs_user_traf">
		<getdata>
			<selstring name="get_accounts" dataid="ch1data1"/>
			<frame name="ch1fr1" datasource="ch1data1" type="current" format="current">
				<inserttext text="ID"/>
				<insertblock/>
				<insertdatanontext index = '0' subindex="0"/>
				<insertblock/>
				<inserttext text="uname"/>
				<insertblock/>
				<insertdatatext index = '0' subindex="1"/>
				<insertblock blockformat="bf1"/>
				<inserttext text="VPN IP"/>
				<insertblock blockformat="defbf"/>
				<insertdatatext index = '0' subindex="2"/>
				<insertblock/>
				<inserttext text="UPN IP"/>
				<insertblock/>
				<insertdatatext index = '0' subindex="3"/>
				<insertblock/>
				<inserttext text="                  "/>
				<table name="tbl2" columns="4" type="normal"  fname="tf2" ftype="new" setCellPadding="2" celltf="tf1" setBackground="#c0a0c0" >
					<column name="ID" type="int" />
					<column name="uname" type="string" />
					<column name="vpn ip" type="string" />
					<column name="upn ip" type="string" />
				</table>
			</frame>			
		</getdata>
		<getdata>
			<selstring name="get_tarifs" dataid="ch1data2"/>
			<frame name="ch1fr2" datasource="ch1data2"  format="new" fname="nnn" setBorder="12" setBorderStyle="2" setPosition="0" setWidth="69%" setBackground="#c0a0c0" >
				<inserttext text="ZOMG TABLE" textformat="tf1"/>
				<insertblock/>
				<table name="tbl1" columns="2" type="array" arheader="              Table for account ID: %d" setAlignment="22" fname="tf1" ftype="new" colnametf="tf1" arheadtf="tf1" arheadbf="bf1">
					<column name="Tariff" type="string" />
					<column name="Date" type="string" />
				</table>
			</frame>
		</getdata>
	</chart>
	<inserttext text="ахшобцибя"/>
	<insertblock/>
  </frame>
</report>