<?xml version="1.0" encoding="utf-8"?>
<!-- Created with Liquid XML Studio 1.0.8.0 (http://www.liquid-technologies.com) -->
<report xmlns:xsi="http://www.w3.org/2001/XMLSchema-instance" xsi:noNamespaceSchemaLocation="report_schema.xsd">
  <textformat setFontWeight="string" setFontUnderline="string" setFontFamily="string" />
  <frame name="string" type="string" setHeight="string" setPosition="string" setMargin="string">
    <frame name="string" type="string" format="string" fname="string" formattype="string">
      <frame format="string" fname="string" formattype="string" setBorder="string" setWidth="string" setPosition="string" setMargin="string" setBorderStyle="string">
        <frame name="string" type="string" format="string" fname="string" formattype="string" setHeight="string" setWidth="string" setPosition="string" setMargin="string" />
      </frame>
      <inserttext text="string" />
      <insertblock />
    </frame>
    <inserttext textformat="string" />
    <insertblock number="string" />
  </frame>
</report>