<?xml version="1.0" encoding="utf-8"?>
<!-- Created with Liquid XML Studio 1.0.8.0 (http://www.liquid-technologies.com) -->
<report xmlns:xsi="http://www.w3.org/2001/XMLSchema-instance" xsi:noNamespaceSchemaLocation="report_schema.xsd">
  <textformat name="tf1" setFontWeight="96" setFontPointSize="14" />
  <textformat name="tf2" setFontWeight="72" setFontPointSize="12" setFontItalic="true" />
  <blockformat name="bf1" setAlignment="22" />
  <frame name="topframe" type="current" format="currentedit" fname="tff" padding="16">
    <frame name="referenceframe" type="insert" format="new" fname="rff" formattype="textframe" padding="16">
	  <insertblock blockformat="bf1"/>
      <inserttext text="Скорость по портам" textformat="tf1"/>
      <insertblock blockformat="defbf"/>
    </frame>    
    <insertblock />
	<insertblock />
	<insertblock />

	<chart library="pychartdir" name="chart1" type="nfs_port_speed">
		<getdata>
				<frame name="fr2" datasource="args" type="current" format="currentnew" fname="tff1">
					<insertblock />
					<insertblock />
					<inserttext text="Дата начала: " textformat="tf2" />
					<insertdatanontext index = '0' />
					<insertblock />
					<inserttext text="Дата окончания: "/>
					<insertdatanontext index = '1' />
					<insertblock />
					<insertblock />
			</frame>
		</getdata>		
	</chart>

  </frame>
</report>