<?xml version="1.0" encoding="utf-8"?>
<!-- Created with Liquid XML Studio 1.0.8.0 (http://www.liquid-technologies.com) -->
<report xmlns:xsi="http://www.w3.org/2001/XMLSchema-instance" xsi:noNamespaceSchemaLocation="report_schema.xsd">
	<textformat name="whitetf10" setFontWeight="72" setFontPointSize="10" setForeground="#FFFFFF" />
	<textformat name="stf1" setFontWeight="72" setFontPointSize="12" setForeground="#3d3d3d" />
	<textformat name="stf2" setFontWeight="72" setFontPointSize="11" setForeground="#5e93b6" />
	<textformat name="stf3" setFontWeight="36" setFontPointSize="11" setForeground="#000000" />
	<blockformat name="centerbf" setAlignment="22" />
	<frame name="topframe" format="currentedit" setWidth="840" fname="topff" padding="0">
		<image path="images/reports/header.png" />
		<frame name="uprblockfr" format="new" fname="ubff" setHeight="50" setWidth="840" padding="4" setBackground="#323232">
			<insertblock blockformat="centerbf" />
			<inserttext text="Отчёт по классам траффика с выбором пользователя" textformat="whitetf10" />
			<insertblock />
		</frame>
		<frame name="cframe" type="existing" format="new" setWidth="840" fname="cff">
			<insertblock blockformat="centerbf" />

	<chart library="pychartdir" name="chart1" type="nfs_total_users_traf">
		<getdata>
			<selstring name="get_tarifs" dataid="ch1data2"/>
		</getdata>
		<getdata>
			<selstring name="get_accounts" dataid="ch1data1"/>		
		</getdata>
		<getdata>
			<selstring name="get_nas" dataid="ch1datanas"/>
		</getdata>		
	</chart>
	<insertblock blockformat="centerbf" />
			<stable name="schtbl1" rownum="1" colnum="1" ftype="new" fname="schtf" setAlignment="22" setCellPadding="0" setBorderStyle="0">
				<scell row="0" col="0">
					<table name="tbl2" columns="5" type="normal" datasource="ch1data1" arheader="Выбранные пользователи: "  fname="tf2" ftype="new" setCellPadding="2" setCellSpacing="2"  setBackground="#ececec" setAlignment="22">
					<column name="ID" type="int" />
					<column name="Username" type="string" />
					<column name="VPN IP" type="string" />
					<column name="IPN IP" type="string" />
					<column name="Тарифы" type="table" datasource="ch1data2" imerge="0" ibase="1" tftype="new" tfname="zomg" setBorder="1" colConstrType="percentage" colConstraints="70, 30" setAlignment="22"/>
				</table>
				</scell>
			</stable>
			<insertblock blockformat="centerbf" />
			<stable name="schtbl2" rownum="1" colnum="1" ftype="new" fname="schtf" setAlignment="22" setCellPadding="0" setBorderStyle="0">
				<scell row="0" col="0">
					<table name="tbl3" columns="2" type="normal" datasource="ch1datanas" ftype="new" setCellPadding="2" setBackground="#ececec" fname="tf2" arheader="Выбранные серверы доступа: ">
					<column name="Имя" type="string" />
					<column name="Тип" type="string" />
				</table>
				</scell>
			</stable>
	</frame>
		<frame name="chtbl2fr" datasource="args" type="current" format="currentnew" setWidth="840" fname="chtbl2ff">
			<insertblock />
			<insertblock blockformat="centerbf" />
			<inserttext text="ПЕРИОД: " textformat="stf1" />
			<inserttext text="с " textformat="stf3" />
			<insertdatanontext index="0" textformat="stf2" />
			<inserttext text=" по " textformat="stf3" />
			<insertdatanontext index="1" textformat="stf2" />
			<insertblock />
			<insertblock />
		</frame>
  </frame>
</report>