<?xml version="1.0" encoding="utf-8"?>
<!-- Created with Liquid XML Studio 1.0.8.0 (http://www.liquid-technologies.com) -->
<report xmlns:xsi="http://www.w3.org/2001/XMLSchema-instance" xsi:noNamespaceSchemaLocation="report_schema.xsd">
  <textformat name="tf1" setFontWeight="96" setFontPointSize="14" />
  <textformat name="tf2" setFontWeight="72" setFontPointSize="12" setFontItalic="true" />
  <blockformat name="bf1" setAlignment="22" />
  <frame name="topframe" type="current" format="currentedit" fname="tff" padding="16">
    <frame name="referenceframe" type="insert" format="new" fname="rff" formattype="textframe" padding="16">
	  <insertblock blockformat="bf1"/>
      <inserttext text="Отчёт по классам траффика с выбором пользователя" textformat="tf1"/>
      <insertblock blockformat="defbf"/>
    </frame>    
    <insertblock />
	<insertblock />
	<insertblock />

	<chart library="pychartdir" name="chart1" type="nfs_user_traf">
		<getdata>
			<selstring name="get_tarifs" dataid="ch1data2"/>
				<frame name="fr2" datasource="args" type="current" format="currentnew" fname="tff1">
					<insertblock />
					<insertblock />
					<inserttext text="Дата начала: " textformat="tf2" />
					<insertdatanontext index = '1' />
					<insertblock />
					<inserttext text="Дата окончания: "/>
					<insertdatanontext index = '2' />
					<insertblock />
					<insertblock />
			</frame>
		</getdata>
		<getdata>
			<selstring name="get_accounts" dataid="ch1data1"/>
			<frame name="ch1fr1" datasource="ch1data1" type="current" format="current">
				<inserttext text="Выбранные пользователи: "/>
				<insertblock/>
				<table name="tbl2" columns="5" type="normal"  fname="tf2" ftype="new" setCellPadding="2"  setBackground="#c0a0c0" >
					<column name="ID" type="int" />
					<column name="username" type="string" />
					<column name="vpn ip" type="string" />
					<column name="upn ip" type="string" />
					<column name="тарифы" type="table" datasource="ch1data2" imerge="0" ibase="1"/>
				</table>
			</frame>			
		</getdata>
		<getdata>
			<selstring name="get_nas" dataid="ch1datanas"/>
			<insertblock/>
			<insertblock/>
			<insertblock/>
			
			<frame name="ch1fr4" datasource="ch1datanas" type="current" format="current">
				<table name="tbl3" columns="2" type="normal" ftype="existing" fname="tf2" arheader="Выбранные серверы доступа: ">
					<column name="Имя" type="string" />
					<column name="Тип" type="string" />
				</table>
			</frame>
		</getdata>		
	</chart>

  </frame>
</report>