<?xml version="1.0" encoding="utf-8"?>
<!-- Created with Liquid XML Studio 1.0.8.0 (http://www.liquid-technologies.com) -->
<report xmlns:xsi="http://www.w3.org/2001/XMLSchema-instance" xsi:noNamespaceSchemaLocation="report_schema.xsd">
  <textformat name="tf1" setFontWeight="96" setFontPointSize="18" setFontItalic="true" setForeground="#00ff00"/>
  <textformat name="tf2" setFontWeight="72" setFontPointSize="12" setFontItalic="true" />
  <textformat name="tf3" setFontWeight="72" setFontPointSize="10" setForeground="#FFFFFF" />
  <textformat name="stf1" setFontWeight="72" setFontPointSize="12" setForeground="#3d3d3d" />
  <textformat name="stf2" setFontWeight="72" setFontPointSize="11" setForeground="#5e93b6" />
  <textformat name="stf3" setFontWeight="36" setFontPointSize="11" setForeground="#000000" />
  <blockformat name="bf1" setAlignment="22" />
  <frame name="topframe"  type="current" format="currentedit" setWidth="1000"  fname="tff" padding="16">
	<image path="images/reports/header.png"/>
	
	<frame name="blfr"  type="insert" format="new" fname="rff" setHeight="50" setWidth="1000" padding="4"  setBackground="#323232">
		<insertblock blockformat="bf1"/>
		<inserttext text="Траффик пользователей" textformat="tf3" />
		<insertblock />
	</frame>

	<frame name="cframe"  type="existing" format="new" setWidth="1000" fname="tff7">
	<stable name="stbl2" rownum="1" colnum="2" ftype="new" fname="stf1" setAlignment="22" setCellPadding="0" setBorderStyle="0">
		<scell row="0" col="0">
			<chart library="pychartdir" name="chart1" type="userstrafpie">	
				<getdata/>
			</chart>
		</scell>
		<scell row="0" col="1">
			<table name="tbl2" columns="2" datasource="chart1_return"  type="normal"  fname="tf2" ftype="new" setCellPadding="2"  setBackground="#ececec" >
				<column name="Имя пользователя" type="string" />
				<column name="Траффик" type="int" />
			</table>
		</scell>
	</stable>
		
				
	</frame>
	<frame name="fr2" datasource="args" type="current" format="currentnew" setWidth="1000" fname="tff1">
		<insertblock />
		<insertblock blockformat="bf1"/>
		<inserttext text="ПЕРИОД: " textformat="stf1" />
		<inserttext text="с " textformat="stf3" />
		<insertdatanontext index = '0' textformat="stf2" />
		<inserttext text=" по " textformat="stf3" />
		<insertdatanontext index = '1' textformat="stf2"/>
		<insertblock />
		<insertblock />
	</frame>
  </frame>
</report>