<?xml version="1.0" encoding="utf-8"?>
<!-- Created with Liquid XML Studio 1.0.8.0 (http://www.liquid-technologies.com) -->
<report xmlns:xsi="http://www.w3.org/2001/XMLSchema-instance" xsi:noNamespaceSchemaLocation="report_schema.xsd">
  <textformat name="tf1" setFontWeight="96" setFontPointSize="18" setFontItalic="true" setForeground="#00ff00"/>
  <textformat name="tf2" setFontWeight="72" setFontPointSize="12" setFontItalic="true" setForeground="#00ff00"/>
  <blockformat name="bf1" setAlignment="22" />
  <frame name="topframe" type="current" format="currentedit" fname="tff" padding="16">
    <frame name="referenceframe" type="insert" format="new" fname="rff" formattype="textframe" padding="16">
	  <insertblock blockformat="bf1"/>
      <inserttext text="Отчёт по классам траффика с выбором пользователя" textformat="tf1"/>
      <insertblock blockformat="defbf"/>
    </frame>    
    <insertblock />
	<insertblock />
	<insertblock />
	<frame name="fr2" datasource="args" type="current" format="currentnew" fname="tff1">
		<inserttext text="Input data: " textformat="tf2" />
		<insertblock />
		<insertblock />
		<inserttext text="User ID: "/>
		<insertdatanontext index = '0' />
		<insertblock />
		<inserttext text="DOS: "/>
		<insertdatanontext index = '1' />
		<insertblock />
		<inserttext text="DOE: "/>
		<insertdatanontext index = '2' />
		<insertblock />
		<insertblock />
	</frame>
	<chart library="pychartdir" name="chart1" type="nfs_user_traf">
		<getdata>
			<selstring name="get_accounts" dataid="ch1data1"/>
			<frame name="fr3" datasource="chart1_return" type="current" format="current">
				<insertblock />
				<inserttext text="Aggregated by: "/>
				<insertdatanontext key="sec" />
				<inserttext text="    seconds"/>
				<insertblock />
			</frame>
			<frame name="ch1fr1" datasource="ch1data1" type="current" format="current">
				<inserttext text="ID"/>
				<insertblock/>
				<insertdatanontext index = '0' subindex="0"/>
				<insertblock/>
				<inserttext text="uname"/>
				<insertblock/>
				<insertdatatext index = '0' subindex="1"/>
				<insertblock />
				<inserttext text="VPN IP"/>
				<insertblock />
				<insertdatatext index = '0' subindex="2"/>
				<insertblock/>
				<inserttext text="UPN IP"/>
				<insertblock/>
				<insertdatatext index = '0' subindex="3"/>
				<insertblock/>
				<inserttext text="                  "/>
				<table name="tbl2" columns="4" type="normal"  fname="tf2" ftype="new" setCellPadding="2"  setBackground="#c0a0c0" >
					<column name="ID" type="int" />
					<column name="uname" type="string" />
					<column name="vpn ip" type="string" />
					<column name="upn ip" type="string" />
				</table>
			</frame>			
		</getdata>
		<getdata>
			<selstring name="get_tarifs" dataid="ch1data2"/>
			<frame name="ch1fr2" datasource="ch1data2"  format="new" fname="nnn"  setBorderStyle="2" setPosition="0" >
				<inserttext text="Таблицы" textformat="tf2"/>
				<insertblock/>
				<table name="tbl1" columns="2" type="array" ftype="new" arheader="              Table for account ID: %s" setAlignment="22" fname="tf1"  arheadtf="tf2" arheadbf="bf1">
					<column name="Tariff" type="string" />
					<column name="Date" type="string" />
				</table>
			</frame>
		</getdata>
	</chart>

  </frame>
</report>